product name,price
"Apple iPhone SE (Black, 64 GB)","₹42,500"
"Apple iPhone SE (White, 64 GB)","₹42,500"
"Apple iPhone SE (Red, 64 GB)","₹42,500"
"Apple iPhone SE (Black, 128 GB)","₹47,800"
"Apple iPhone SE (White, 128 GB)","₹47,800"
"Apple iPhone 7 (Black, 32 GB)","₹29,499"
"Apple iPhone 11 (Black, 64 GB)","₹68,300"
"Apple iPhone 11 (Black, 128 GB)","₹73,600"
Apple MacBook Air Core i5 5th Gen - (8 GB/128 GB SSD/Mac OS Sierra) MQD32HN/A A1466,"₹65,990"
Apple MacBook Pro Core i5 8th Gen - (8 GB/128 GB SSD/Mac OS Mojave) MUHN2HN/A,"₹1,04,990"
Apple MacBook Air Core i5 8th Gen - (8 GB/128 GB SSD/Mac OS Mojave) MVFH2HN/A,"₹94,990"
Apple AirPods with Charging Case Bluetooth Headset with Mic,"₹14,602"
Apple AirPods with Wireless Charging Case Bluetooth Headset with Mic,"₹17,999"
Apple White MMX62ZM/A Lightning to 3.5 mm Phone Converter,₹899
"Apple iPhone 11 (White, 64 GB)","₹68,300"
"Apple iPhone XR (Black, 64 GB)","₹52,500"
"Apple iPhone 11 (White, 128 GB)","₹73,600"
"Apple iPhone 7 Plus (Black, 32 GB)","₹36,999"
"Apple iPhone 11 (Purple, 128 GB)","₹73,600"
"Apple iPhone XR (White, 64 GB)","₹52,500"
"Apple iPhone XR ((PRODUCT)RED, 64 GB)","₹52,500"
"Apple iPhone 11 (Green, 128 GB)","₹73,600"
Apple MacBook Pro Core i7 9th Gen - (16 GB/512 GB SSD/Mac OS Catalina/4 GB Graphics) MVVJ2HN/A,"₹1,89,000"
Apple MacBook Pro Core i9 9th Gen - (16 GB/1 TB SSD/Mac OS Catalina/4 GB Graphics) MVVK2HN/A,"₹2,39,900"
Ant Audio Wave Sports 535 Bluetooth Headset,"₹1,199"
Apple MD836HN/A 12W USB Power Adapter,"₹1,699"
"Apple iPhone XR (White, 128 GB)","₹57,800"
"Apple iPhone 11 (Red, 64 GB)","₹68,300"
"Apple iPhone XR (Blue, 64 GB)","₹52,500"
"Apple iPhone XR (Coral, 64 GB)","₹52,500"
"Apple iPhone 11 Pro Max (Silver, 256 GB)","₹1,31,900"
"Apple iPhone 11 Pro Max (Midnight Green, 256 GB)","₹1,31,900"
"Apple iPhone 11 Pro (Silver, 64 GB)","₹1,06,600"
"Apple iPhone 11 Pro (Midnight Green, 64 GB)","₹1,06,600"
Apple MacBook Pro Core i9 9th Gen - (16 GB/1 TB SSD/Mac OS Catalina/4 GB Graphics) MVVM2HN/A,"₹2,39,900"
Apple MacBook Pro Core i5 7th Gen - (8 GB/128 GB SSD/Mac OS Sierra) MPXR2HN/A,"₹1,12,990"
Apple MacBook Pro Core i5 8th Gen - (8 GB/256 GB SSD/Mac OS Mojave) MV962HN,"₹1,54,990"
Hitage in-Ear Earphone Wired Headset with HD Voice Mic (Black) Wired Headset,₹169
quadronic Earphone Wired Headset,₹250
Apple Watch Series 3 GPS - 42 mm Space Grey Aluminium Case with Black Sport Band,"₹23,900"
"Apple iPhone 8 (Silver, 64 GB)","₹38,999"
"Apple iPhone 11 (Yellow, 128 GB)","₹73,600"
"Apple iPhone 11 Pro (Space Grey, 256 GB)","₹1,21,300"
"Apple iPhone 11 Pro (Midnight Green, 256 GB)","₹1,21,300"
"Apple iPhone 11 Pro Max (Gold, 64 GB)","₹1,17,100"
"Apple iPhone 11 Pro Max (Space Grey, 64 GB)","₹1,17,100"
"Apple iPhone 7 Plus (Silver, 32 GB)","₹36,999"
"Apple iPhone 11 Pro (Gold, 64 GB)","₹1,06,600"
GALI BAZAR galA183 Bluetooth Headset,"₹1,499"
Brown Bee M9 Rich Bass Strome Quality Earphone Wired Headset,₹151
Apple MD592HN/A MagSafe 2 Power Adapter for MacBook Air  45 W  Adapter,"₹7,499"
"Apple iPhone SE (White, 256 GB)","₹58,300"
"Apple iPhone 7 (Gold, 32 GB)","₹36,999"
"Apple iPhone 11 Pro (Gold, 256 GB)","₹1,21,300"
"Apple iPhone X (Silver, 64 GB)","₹84,999"
"Apple iPhone 8 (Gold, 64 GB)","₹38,999"
"Apple iPhone 7 (PRODUCT) (Red, 256 GB)","₹63,999"
"Apple iPhone 8 Plus (Gold, 64 GB)","₹76,000"
"Apple iPhone XS Max (Space Grey, 512 GB)","₹1,19,900"
Apple MacBook Air Core i5 8th Gen - (8 GB/256 GB SSD/Mac OS Mojave) MVFL2HN/A,"₹1,11,190"
Apple MacBook Air Core i5 8th Gen - (8 GB/128 GB SSD/Mac OS Mojave) MRE82HN/A,"₹1,08,990"
Apple MacBook Air Core i5 8th Gen - (8 GB/128 GB SSD/Mac OS Mojave) MREE2HN/A,"₹1,06,990"
MGEdge App_le Headphone Original Branded Earphone Buds 2 all Mobile Wired Headset,₹399
Brown Bee 3.5mm Jack 100% Original Earphone For All Smart Phones With MIC Wired Headset,₹198
Apple Watch Series 3 GPS - 38 mm Space Grey Aluminium Case with Black Sport Band,"₹20,900"
"Apple iPhone 6s (Rose Gold, 32 GB)","₹28,955"
"Apple iPhone XR (Black, 128 GB)","₹69,999"
"Apple iPhone 8 (Silver, 256 GB)","₹57,990"
"Apple iPhone 8 (Gold, 256 GB)","₹57,990"
"Apple iPhone X (Space Gray, 64 GB)","₹85,000"
hitvill HBS-730 Bluetooth Headset 100% Original Deep Bass Bluetooth Headset,₹399
musicly HD Sound Earphone Appl.e/Sam.sung/VI.VO/OPPO RoundHeadset White5 Wired Headset,₹299
bs power EZ414 Wired Headset,₹347
Apple Watch Series 5 GPS + Cellular 40 mm Space Grey Aluminium Case with Black Sport Band,"₹49,900"
GALI BAZAR GBPrf67 Bluetooth Headset,₹521
MATT PIE Universal Samsang IG955 AKG Nylone Wire Earphone/Hands free Mic For Apple/ Samsung / Oppo / V...,₹230
Apple Watch Series 5 GPS + Cellular 44 mm Space Grey Aluminium Case with Black Sport Band,"₹52,900"
GALI BAZAR galA96 Bluetooth Headset,"₹1,599"
Gali Bazar GITW15 Bluetooth Headset,"₹1,599"
Apple MD819ZM/A Lightning to USB Cable (2 m) Lightning Cable,"₹2,595"
GALI BAZAR galA196 Bluetooth Headset,"₹1,499"
GALI BAZAR GBPrf91 Bluetooth Headset,₹521
Apple Thunderbolt 3 (USB-C) to Thunderbolt 2 W Adapter,"₹4,399"
GALI BAZAR galA174 Bluetooth Headset,"₹1,499"
Ferons I_phone X Sa.ms_ung Redmii 3.5 mm earphone handfree headphone Wired Headset,₹352
Apple Watch Series 3 42 mm Silver Aluminum White Sport Band (GPS),"₹23,900"
Uneque Trend AirPods Bluetooth Headset,₹699
quadronic universalheadphone Wired Headset,₹189
Apple Thunderbolt to Gigabit Ethernet Adapter,"₹2,500"
GALI BAZAR GAPO102 Bluetooth Headset,₹421
GALI BAZAR GBPrf83 Bluetooth Headset,₹521
Apple Watch Series 3 GPS - 38 mm Silver Aluminium Case with Fog Sport Band,"₹20,900"
Swiss Military HPH3 – WIRELESS HEADPHONE Bluetooth Headset,"₹1,195"
SECURITY STORE B_4 In-ear Wired Headphone ( Black ) Wired Headset,₹299
Apple USB-C POWER 30 W Adapter,"₹4,500"
Cellphonez Awei Es 500i Black Wired Headset,₹599
Apple MK122HN/A 1 m Power Cord,"₹1,599"
TOHUBOHU earphone with Ultra deep bass sound Wired Headset,₹225
Gali Bazar BGBI233 Bluetooth Headset,₹399
Apple Watch Series 4 GPS + Cellular 40 mm Space Grey Aluminium Case with Black Sport Loop,"₹49,899"
Hitage in-Ear Earphone Wired Headset with Mic & Call Ans.Button (White) Wired Headset,₹299
stnmTK Music Headphone Double Bluetooth Heads Bluetooth Headset Bluetooth Headset,₹549
Apple Watch Series 5 GPS + Cellular 40 mm Space Black Stainless Steel Case with Space Black Milanese L...,"₹69,900"
Allmusic Earphone With 3D Bass Sound Wired Headset,₹282
GALI BAZAR Pro125 Bluetooth Headset,₹421
Apple MC556HN/B MagSafe Power Adapter For MacBook Pro  85 W Adapter,"₹7,000"
GALI BAZAR GAPO202 Bluetooth Headset,₹421
GALI BAZAR GBProf66 Bluetooth Headset,₹399
Apple Watch Series 5 GPS + Cellular 40 mm Stainless Steel Case with White Sport Band,"₹65,900"
TSV i6s Bluetooth With Vibration & Call Function (Golden) Bluetooth Headset,₹899
GALI BAZAR FabA305 Bluetooth Headset,₹499
APPLE TV 4K 64GB,"₹19,480"
GALI BAZAR Mostu153 Bluetooth Headset,₹521
TSV i6s Bluetooth V4.1 Supported Bluetooth Bluetooth Headset,₹799
Apple Watch Series 4 GPS + Cellular 40 mm Space Grey Aluminium Case with Black Sport Band,"₹49,900"
Gali Bazar Gi7S6 Bluetooth Headset,"₹1,316"
GALI BAZAR GBProf72 Bluetooth Headset,₹451
Apple MPTL2LB/A Smart Connector Tablet Keyboard,"₹13,900"
GALI BAZAR GBProf57 Bluetooth Headset,₹412
GALI BAZAR GBProf58 Bluetooth Headset,₹451
GALI BAZAR FabA309 Bluetooth Headset,₹499
APPLE TV 4K 32GB,"₹17,430"
GALI BAZAR Mostu167 Bluetooth Headset,₹521
GALI BAZAR GAPO214 Bluetooth Headset,₹499
Apple USB-C VGA Multiport 2 W Adapter,"₹6,173"
GALI BAZAR Pro13 Bluetooth Headset,₹421
GALI BAZAR Mostu32 Bluetooth Headset,₹521
Apple Watch 38 mm Stainless Steel Stainless Steel Case with Modern Buckle - Small,"₹64,900"
GALI BAZAR Mostu37 Bluetooth Headset,₹521
GALI BAZAR Mostu137 Bluetooth Headset,₹521
Apple MJVU2ZM/A HDMI to DVI Adapter Cable,"₹2,799"
GALI BAZAR Mostu41 Bluetooth Headset,₹521
GALI BAZAR GAPO130 Bluetooth Headset,₹521
Apple Mini DisplayPort to VGA 2 W Adapter,"₹2,499"
GALI BAZAR GAPO48 Bluetooth Headset,₹521
GALI BAZAR GAPO83 Bluetooth Headset,₹521
"Apple Watch Series 4 GPS + Cellular, 44 mm Gold Aluminium Case with Pink Sand Sport Loop","₹52,900"
GALI BAZAR GAPO227 Bluetooth Headset,₹499
GALI BAZAR Mostu99 Bluetooth Headset,₹521
GALI BAZAR Mostu154 Bluetooth Headset,₹521
GALI BAZAR GBProf27 Bluetooth Headset,₹451
Apple MINI DISPLAYPORT TO DVI 2 W Adapter,"₹2,499"
GALI BAZAR GBProf77 Bluetooth Headset,₹451
GALI BAZAR GBProf78 Bluetooth Headset,₹399
GALI BAZAR GAPO111 Bluetooth Headset,₹521
Apple Back Cover for Apple iPhone 11 Pro Max,"₹3,499"
GALI BAZAR GBProf15 Bluetooth Headset,₹451
GALI BAZAR GBProf90 Bluetooth Headset,₹399
Apple Core i5 (7th Gen) (8 GB DDR4/1 TB/Mac OS X Sierra/21.5 Inch Screen),"₹90,200"
GALI BAZAR galA117 Bluetooth Headset,"₹1,599"
GALI BAZAR GBProf14 Bluetooth Headset,₹451
Apple Back Cover for iPhone 11 Pro,"₹3,499"
GALI BAZAR Mostu151 Bluetooth Headset,₹521
GALI BAZAR GAPO134 Bluetooth Headset,₹421
Apple MC461HN/A MagSafe Power Adapter For MacBook and MacBook Pro  60 W Adapter,"₹7,500"
GALI BAZAR GAPO190 Bluetooth Headset,₹421
GALI BAZAR GBProf44 Bluetooth Headset,₹451
Apple iPad (6th Gen) 128 GB 9.7 inch with Wi-Fi+4G (Silver),"₹46,300"
GALI BAZAR GAPO27 Bluetooth Headset,₹521
GALI BAZAR Mostu83 Bluetooth Headset,₹521
Apple iPad (6th Gen) 128 GB 9.7 inch with Wi-Fi+4G (Gold),"₹46,300"
GALI BAZAR GAPO154 Bluetooth Headset,₹421
GALI BAZAR GBProf1 Bluetooth Headset,₹451
Apple iPad (6th Gen) 128 GB 9.7 inch with Wi-Fi+4G (Space Grey),"₹46,300"
GALI BAZAR Mostu13 Bluetooth Headset,₹521
GALI BAZAR GBProf33 Bluetooth Headset,₹451
Apple Flip Cover for Apple iPad mini 4 7.9 inch,"₹2,699"
GALI BAZAR GAPO107 Bluetooth Headset,₹499
Apple Back Cover for Apple iPad mini 4 7.9 inch,"₹4,599"
MGEdge REAL_ME BRANDED HEADPHONE BUD 2 ORIGINAL EARPHONE 10D QUALITY Wired Headset,₹525
"DOLEVAS Buy ap_ple earphone S9 for iphon_e 5,5c,5s,6,6s,6plus,7,7s,7pls Wired Headset",₹179
Apple MC748ZM/A Composite AV Cable,"₹3,300"
Gali Bazar BGBI53 Bluetooth Headset,₹421
Gali Bazar BGBI184 Bluetooth Headset,₹425
Apple Back Cover for Apple iPad mini 4 7.9 inch,"₹4,900"
Gali Bazar BGBI140 Bluetooth Headset,₹425
Gali Bazar BGBI170 Bluetooth Headset,₹499
Apple Back Cover for Apple iPad mini 4 7.9 inch,"₹4,599"
Gali Bazar BGBI139 Bluetooth Headset,₹499
Gali Bazar BGBI211 Bluetooth Headset,₹421
Apple Back Cover for Apple iPad mini 4 7.9 inch,"₹4,900"
Gali Bazar BGBI247 Bluetooth Headset,₹421
Gali Bazar BGBI94 Bluetooth Headset,₹449
Apple Back Cover for Apple iPad mini 4 7.9 inch,"₹4,599"
Gali Bazar 1086i7TA Bluetooth Headset,"₹1,499"
Gali Bazar BGBI289 Bluetooth Headset,₹425
Apple Folio for 12.9-inch iPad Pro Smart Connector Tablet Keyboard,"₹17,468"
Gali Bazar BGBI120 Bluetooth Headset,₹425
Gali Bazar BGBI21 Bluetooth Headset,₹499
Apple Core i5 (5th Gen) (8 GB DDR3/1 TB/Mac OS X Lion/1 GB/21.5 Inch Screen),"₹95,990"
Gali Bazar BGBI212 Bluetooth Headset,₹425
Gali Bazar BGBI305 Bluetooth Headset,₹499
Gali Bazar BGBI145 Bluetooth Headset,₹499
Gali Bazar BGBI69 Bluetooth Headset,₹499
"Apple Sleeve for iPad Pro 12.9-inch (2018), iPad Pro 12.9(1st generation), iPad Pro 12.9-inch (2nd gen...","₹12,700"
Gali Bazar BGBI176 Bluetooth Headset,₹499
Gali Bazar Gi7S4 Bluetooth Headset,"₹1,799"
Apple Back Cover for iPad Pro 9.7 inch (2016),"₹1,999"
Gali Bazar BGBI296 Bluetooth Headset,₹399
Gali Bazar BGBI276 Bluetooth Headset,₹425
Apple Back Cover for Apple iPad mini 4 7.9 inch,"₹2,199"
Gali Bazar BGBI83 Bluetooth Headset,₹499
Gali Bazar Gi7S10 Bluetooth Headset,"₹1,799"
"Apple Flip Cover for iPad mini 4 7.9 inch, iPad Mini (2019)","₹3,199"
Gali Bazar 1295i7TA Bluetooth Headset,"₹1,499"
Gali Bazar BGBI91 Bluetooth Headset,₹499
Apple Back Cover for iPad Pro 9.7 inch (2016),"₹1,999"
Gali Bazar 1552i7TA Bluetooth Headset,"₹1,499"
Gali Bazar GDE228 Bluetooth Headset,"₹1,599"
Apple Back Cover for Apple iPad mini 4 7.9 inch,"₹2,199"
Gali Bazar 1504i7TA Bluetooth Headset,"₹1,499"
Gali Bazar BGBI318 Bluetooth Headset,₹499
Apple Watch Series 5 GPS + Cellular 44 mm Stainless Steel Case with Stainless Steel Milanese Loop,"₹73,900"
Gali Bazar BGBI73 Bluetooth Headset,₹421
TSV Mini i6S Bluetooth Headset,₹899
Apple Flip Cover for iPad Pro 9.7 inch (2016),"₹2,499"
